{
  "id": "node-24-windows-arm64",
  "version": "24.21.0",
  "description": "Node.js 24.21.0 runtime archive for Windows arm64; exact vendor artifact pinned for local web development.",
  "purpose": "Provide a reproducible Node.js runtime for project-selected web development tasks.",
  "supported_platforms": [
    "windows-arm64"
  ],
  "prerequisites": [],
  "detection": "Manual eligibility check: confirm Windows arm64, the vendor floor (Windows 10 or later for x64 (Windows Server 2016 or later); Windows 10 or later for arm64. Current platform facts do not include Windows version.), and that the OS release is still vendor-supported. Version/kernel/libc qualification is not available in MachineFacts for this platform cell; unknown never qualifies.",
  "install_strategy": "manual",
  "artifact": {
    "digest": "8779b1bde1d39f8d420e3b57aa657b39891af434d3de44a919044cec06785921",
    "size": 33679608,
    "origin": "https://nodejs.org/dist/v24.21.0/node-v24.21.0-win-arm64.zip"
  },
  "privileges": [
    "user"
  ],
  "license_notes": "Node.js is MIT-licensed. The upstream distribution contains third-party components with separate license terms; retain and review all included notices. This recipe does not redistribute the archive.",
  "estimated_download_bytes": 33679608,
  "side_effects": [
    "Manual download and extraction into an Anza-managed, user-writable runtime location; no global PATH or project-file mutation is specified."
  ],
  "verification": "Before use, verify the signed SHASUMS256.txt.asc with the official Node.js release keyring using gpgv, then compare this artifact SHA-256; confirm node --version reports v24.21.0. The source signature and downloaded artifact were not locally verified in this task.",
  "reversal_class": "manual"
}
