{
  "id": "node-24-darwin-amd64",
  "version": "24.21.0",
  "description": "Node.js 24.21.0 runtime archive for macOS x64; exact vendor artifact pinned for local web development.",
  "purpose": "Provide a reproducible Node.js runtime for project-selected web development tasks.",
  "supported_platforms": [
    "darwin-amd64"
  ],
  "prerequisites": [],
  "detection": "Manual eligibility check: confirm macOS x64, the vendor floor (macOS 13.5 or later; current platform facts do not include macOS version.), and that the OS release is still vendor-supported. Version/kernel/libc qualification is not available in MachineFacts for this platform cell; unknown never qualifies.",
  "install_strategy": "manual",
  "artifact": {
    "digest": "1462cb3b3046b815cf8ea436d3da450ec1a9f11dac7e5a46b0ada5305d7e8097",
    "size": 54203979,
    "origin": "https://nodejs.org/dist/v24.21.0/node-v24.21.0-darwin-x64.tar.gz"
  },
  "privileges": [
    "user"
  ],
  "license_notes": "Node.js is MIT-licensed. The upstream distribution contains third-party components with separate license terms; retain and review all included notices. This recipe does not redistribute the archive.",
  "estimated_download_bytes": 54203979,
  "side_effects": [
    "Manual download and extraction into an Anza-managed, user-writable runtime location; no global PATH or project-file mutation is specified."
  ],
  "verification": "Before use, verify the signed SHASUMS256.txt.asc with the official Node.js release keyring using gpgv, then compare this artifact SHA-256; confirm node --version reports v24.21.0. The source signature and downloaded artifact were not locally verified in this task.",
  "reversal_class": "manual"
}
